{
  "schema_version": 1,
  "policy_version": 1,
  "connection_id": "synthetic-dev",
  "host_binding": "synthetic-host-binding",
  "target": {
    "server": "synthetic.database.windows.net",
    "database": "SyntheticDb"
  },
  "identity": {
    "tenant_id": "11111111-1111-4111-8111-111111111111",
    "object_id": "11111111-1111-4111-8111-111111111111",
    "database_principal": "synthetic-principal"
  },
  "environment": "DEV",
  "allowed_operations": [
    "SELECT",
    "UPDATE",
    "DELETE"
  ],
  "objects": [
    {
      "schema": "dbo",
      "name": "Orders",
      "operations": [
        "SELECT",
        "UPDATE",
        "DELETE"
      ],
      "read_columns": [
        "OrderId",
        "Status"
      ],
      "write_columns": [
        "Status"
      ],
      "key_columns": [
        "OrderId"
      ],
      "row_scope": [
        {
          "column": "OrderId",
          "operator": "EQ",
          "values": [
            {
              "name": "@authorized_id",
              "type": "int",
              "value": 42
            }
          ]
        }
      ],
      "dependency_state": "confirmed",
      "dependency_revision": "synthetic-reviewed-dependency-snapshot",
      "schema_fingerprint": "0000000000000000000000000000000000000000000000000000000000000000"
    }
  ],
  "limits": {
    "operation_timeout_ms": 30000,
    "max_result_rows": 1000,
    "max_result_bytes": 1048576,
    "max_write_rows": 10,
    "lock_timeout_ms": 5000,
    "max_concurrent_requests": 1
  },
  "confirmed_by": "synthetic-human",
  "confirmed_at": "2026-10-07T00:00:00Z",
  "status": "Active"
}
